{
  "$schema": "http://json-schema.org/draft-07/schema#",
  "title": "AI 可达性台账（feature-coverage）",
  "description": "文档站 103 例特性演示 × 分层可达性的单一真源。结构守卫：scripts/check-feature-coverage.mjs；Ajv 校验：scripts/check-data-schemas.mjs。",
  "type": "object",
  "additionalProperties": false,
  "required": ["note", "tiers", "demos", "sites"],
  "properties": {
    "$schema": { "type": "string" },
    "note": { "type": "string", "minLength": 1 },
    "tiers": {
      "description": "四档释义（A 前门声明式 / B from_config / C 逃生舱·函数值 / D 非 AI 目标）",
      "type": "object",
      "additionalProperties": false,
      "required": ["A", "B", "C", "D"],
      "properties": {
        "A": { "type": "string", "minLength": 1 },
        "B": { "type": "string", "minLength": 1 },
        "C": { "type": "string", "minLength": 1 },
        "D": { "type": "string", "minLength": 1 }
      }
    },
    "demos": {
      "type": "array",
      "minItems": 1,
      "items": {
        "type": "object",
        "additionalProperties": false,
        "required": ["id", "group", "title", "tokens"],
        "properties": {
          "id": {
            "type": "string",
            "pattern": "^(?:(?:form|table|crud-page|dialog|advanced|vxe-table)/\\d{2}-[a-z0-9-]+|(?:error-boundary|svg-icon)/[a-z0-9-]+)$",
            "description": "文档引用串本身（<category>/<NN>-<slug>，独立组件页为 <category>/<slug>），由 resolveComponentPath 规则映射到磁盘 .vue"
          },
          "group": {
            "type": "string",
            "enum": ["es-form", "es-table", "es-crud-page", "use-dialog", "linkage", "vxe-table", "es-error-boundary", "svg-icon"]
          },
          "title": { "type": "string", "minLength": 1 },
          "tokens": {
            "type": "array",
            "minItems": 1,
            "items": { "type": "string", "minLength": 1 },
            "description": "能力令牌（须 ∈ scripts/feature-coverage.data.mjs 的 CAPABILITY_TOKENS）"
          },
          "aiCase": {
            "type": "array",
            "minItems": 1,
            "uniqueItems": true,
            "items": {
              "type": "string",
              "pattern": "^[a-z0-9][a-z0-9-]*$"
            },
            "description": "演示该能力的 AI 案例 id（docs/cases/ai-cases.json 的 cases[].id）。一页能力可能由两个案例分别演示（如 table/11 的展开行与树形），故为数组；只在案例的冻结配置真的含该能力的招牌键时登记，未登记 ≠ 不支持"
          },
          "note": { "type": "string" }
        }
      }
    },
    "sites": {
      "description": "AN-28：es-eui / es-pc 两站案例台账（由 scripts/gen-site-coverage.mjs 从磁盘 + demos 派生；未匹配单源演示的案例显式记 D + reason）",
      "type": "array",
      "minItems": 2,
      "items": {
        "type": "object",
        "additionalProperties": false,
        "required": ["site", "root", "refs", "uncovered", "cases"],
        "properties": {
          "site": { "type": "string", "enum": ["es-eui", "es-pc"] },
          "root": { "type": "string", "minLength": 1 },
          "refs": {
            "type": "integer",
            "minimum": 1,
            "description": "映射到单源演示的案例数（验收要求 > 0）"
          },
          "uncovered": { "type": "integer", "minimum": 0 },
          "cases": {
            "type": "array",
            "minItems": 1,
            "items": {
              "type": "object",
              "additionalProperties": false,
              "required": ["id", "demo", "tokens", "tier"],
              "properties": {
                "id": { "type": "string", "minLength": 1 },
                "demo": {
                  "type": ["string", "null"],
                  "description": "对应的单源演示 id；null = 未覆盖（必须 D 档 + reason）"
                },
                "tokens": {
                  "type": "array",
                  "minItems": 1,
                  "items": { "type": "string", "minLength": 1 }
                },
                "tier": { "type": "string", "enum": ["A", "B", "C", "D"] },
                "reason": {
                  "type": "string",
                  "minLength": 1,
                  "description": "未覆盖案例为何记 D 档"
                }
              }
            }
          }
        }
      }
    }
  }
}
