{
  "$schema": "https://liujiaao.github.io/es-plus/ai/feature-coverage.schema.json",
  "note": "AI 可达性台账：文档站 97 例特性演示 × 分层可达性。单一真源——由 scripts/check-feature-coverage.mjs 守卫，与磁盘 examples/**/*.vue、两个 *.data.ts 的 getComponent 引用三方 1:1 咬合。行档由 tokens 最弱档派生。",
  "tiers": {
    "A": "前门声明式一步可达（generate_crud）",
    "B": "声明式，但需 generate_crud_from_config（前门刻意不收）",
    "C": "逃生舱 / 函数值（Tier-3 源码串或闭包）",
    "D": "非 AI 生成目标（宿主编排 / 组件命令式 API）"
  },
  "demos": [
    {
      "id": "form/01-basic",
      "group": "es-form",
      "title": "基础配置表单",
      "tokens": [
        "formtype",
        "validation",
        "formLayout"
      ]
    },
    {
      "id": "form/02-layout",
      "group": "es-form",
      "title": "布局与折叠",
      "tokens": [
        "formLayout"
      ]
    },
    {
      "id": "form/03-conditional",
      "group": "es-form",
      "title": "条件联动表单",
      "tokens": [
        "fieldVisibility",
        "reactions"
      ]
    },
    {
      "id": "form/04-dynamic",
      "group": "es-form",
      "title": "运行期增删表单项",
      "tokens": [
        "hostOrchestration"
      ]
    },
    {
      "id": "form/05-validation",
      "group": "es-form",
      "title": "校验：rules + 自定义 validator",
      "tokens": [
        "validation",
        "validatorFn"
      ]
    },
    {
      "id": "form/06-async-options",
      "group": "es-form",
      "title": "异步数据表单",
      "tokens": [
        "apiParams",
        "reactions",
        "fieldEventFn"
      ]
    },
    {
      "id": "form/07-custom-render",
      "group": "es-form",
      "title": "自定义渲染表单",
      "tokens": [
        "formtype",
        "renderFn"
      ]
    },
    {
      "id": "form/08-dialog",
      "group": "es-form",
      "title": "弹窗内嵌表单",
      "tokens": [
        "formtype",
        "dialogs"
      ]
    },
    {
      "id": "form/09-datetime-range",
      "group": "es-form",
      "title": "日期时间范围",
      "tokens": [
        "formtype"
      ]
    },
    {
      "id": "form/10-cascader",
      "group": "es-form",
      "title": "级联选择器",
      "tokens": [
        "formtype"
      ]
    },
    {
      "id": "form/11-advanced-buttons",
      "group": "es-form",
      "title": "高级按钮区",
      "tokens": [
        "toolbarBtns",
        "renderBtnFn"
      ]
    },
    {
      "id": "form/12-upload",
      "group": "es-form",
      "title": "图片上传",
      "tokens": [
        "formtype",
        "httpRequestFn",
        "fieldEventFn"
      ]
    },
    {
      "id": "form/13-file-upload",
      "group": "es-form",
      "title": "文件上传",
      "tokens": [
        "formtype",
        "renderFn",
        "fieldEventFn"
      ]
    },
    {
      "id": "form/14-preferences",
      "group": "es-form",
      "title": "偏好设置",
      "tokens": [
        "formtype"
      ]
    },
    {
      "id": "form/15-computed-fields",
      "group": "es-form",
      "title": "联动计算",
      "tokens": [
        "reactions",
        "fieldEventFn"
      ]
    },
    {
      "id": "form/16-custom-button",
      "group": "es-form",
      "title": "自定义按钮区",
      "tokens": [
        "renderBtnFn"
      ]
    },
    {
      "id": "form/17-detail-mode",
      "group": "es-form",
      "title": "详情模式",
      "tokens": [
        "hostOrchestration"
      ]
    },
    {
      "id": "form/18-search-form",
      "group": "es-form",
      "title": "组合搜索",
      "tokens": [
        "fieldVisibility",
        "apiParams",
        "formLayout"
      ]
    },
    {
      "id": "form/19-all-formtypes",
      "group": "es-form",
      "title": "全量控件（14 种 formtype）",
      "tokens": [
        "formtype"
      ]
    },
    {
      "id": "form/20-declarative-linkage",
      "group": "es-form",
      "title": "报销单：零回调联动",
      "tokens": [
        "reactions",
        "fieldVisibility",
        "formtype"
      ]
    },
    {
      "id": "table/01-basic",
      "group": "es-table",
      "title": "基础表格",
      "tokens": [
        "columnsDecl"
      ]
    },
    {
      "id": "table/02-toolbar",
      "group": "es-table",
      "title": "表格工具栏",
      "tokens": [
        "tableBtns",
        "sfcSlot"
      ]
    },
    {
      "id": "table/03-custom",
      "group": "es-table",
      "title": "自定义列渲染",
      "tokens": [
        "renderFn",
        "formatterFn",
        "sfcSlot"
      ]
    },
    {
      "id": "table/04-selection",
      "group": "es-table",
      "title": "多选与跨页记忆",
      "tokens": [
        "tableBase",
        "pagination"
      ]
    },
    {
      "id": "table/05-edit",
      "group": "es-table",
      "title": "点击单元格即编辑",
      "tokens": [
        "inlineEdit"
      ]
    },
    {
      "id": "table/06-sort",
      "group": "es-table",
      "title": "前端 / 后端排序",
      "tokens": [
        "columnSortable",
        "defaultSort"
      ],
      "note": "声明式默认排序 A 档；列级 sortable 仅在 columns 上，需 from_config"
    },
    {
      "id": "table/07-group",
      "group": "es-table",
      "title": "分组表头",
      "tokens": [
        "columnGroups"
      ]
    },
    {
      "id": "table/08-fixed",
      "group": "es-table",
      "title": "固定列与高度",
      "tokens": [
        "columnStyle",
        "tableBase"
      ]
    },
    {
      "id": "table/09-pagination",
      "group": "es-table",
      "title": "分页表格：v-model 自动翻页",
      "tokens": [
        "configTableOut",
        "pagination",
        "httpRequestFn"
      ]
    },
    {
      "id": "table/10-remote-data",
      "group": "es-table",
      "title": "远程数据表格",
      "tokens": [
        "configTableOut",
        "pagination",
        "httpRequestFn"
      ]
    },
    {
      "id": "table/11-expand",
      "group": "es-table",
      "title": "展开行与树形",
      "tokens": [
        "expandConfig",
        "treeConfig"
      ]
    },
    {
      "id": "table/12-cell-merge",
      "group": "es-table",
      "title": "单元格合并与行样式",
      "tokens": [
        "mergeConfig",
        "spanMethodFn",
        "tableBase"
      ],
      "note": "声明式合并（mergeConfig）A 档；任意闭包 spanMethod 保真 C 档"
    },
    {
      "id": "table/13-query-table",
      "group": "es-table",
      "title": "配置化查询：零 handleSearch",
      "tokens": [
        "formLayout",
        "apiParams",
        "httpRequestFn"
      ]
    },
    {
      "id": "table/14-row-actions",
      "group": "es-table",
      "title": "行操作按钮与动态显隐",
      "tokens": [
        "operationColumn",
        "renderBtnFn"
      ]
    },
    {
      "id": "table/15-dynamic-columns",
      "group": "es-table",
      "title": "动态列与汇总行",
      "tokens": [
        "columnsDecl",
        "formatterFn",
        "hostOrchestration"
      ]
    },
    {
      "id": "table/16-callback-pipeline",
      "group": "es-table",
      "title": "请求回调管线",
      "tokens": [
        "configTableOut",
        "pagination",
        "httpRequestFn"
      ]
    },
    {
      "id": "table/17-current-row",
      "group": "es-table",
      "title": "当前行与主从联动",
      "tokens": [
        "tableBase",
        "hostOrchestration"
      ]
    },
    {
      "id": "table/18-table-height",
      "group": "es-table",
      "title": "自适应容器高度",
      "tokens": [
        "tableBase"
      ]
    },
    {
      "id": "table/19-code-label",
      "group": "es-table",
      "title": "码值列：零 render 出标签",
      "tokens": [
        "cellDataOptions"
      ]
    },
    {
      "id": "crud-page/01-basic",
      "group": "es-crud-page",
      "title": "基础 CRUD：一行 actions 派生",
      "tokens": [
        "operationColumn"
      ]
    },
    {
      "id": "crud-page/02-multi-dialog",
      "group": "es-crud-page",
      "title": "多弹窗绑定",
      "tokens": [
        "toolbarBtns",
        "operationColumn",
        "dialogs"
      ]
    },
    {
      "id": "crud-page/03-custom-render",
      "group": "es-crud-page",
      "title": "自定义弹窗内容",
      "tokens": [
        "dialogs",
        "renderFn"
      ]
    },
    {
      "id": "crud-page/04-dynamic-title",
      "group": "es-crud-page",
      "title": "动态标题与回填",
      "tokens": [
        "dialogs",
        "renderFn"
      ]
    },
    {
      "id": "crud-page/05-row-confirm",
      "group": "es-crud-page",
      "title": "行确认与删除",
      "tokens": [
        "operationColumn",
        "hostOrchestration"
      ]
    },
    {
      "id": "crud-page/06-permission",
      "group": "es-crud-page",
      "title": "权限控制按钮",
      "tokens": [
        "permissions"
      ]
    },
    {
      "id": "crud-page/07-custom-footer",
      "group": "es-crud-page",
      "title": "自定义弹窗底部",
      "tokens": [
        "dialogs",
        "renderBtnFn"
      ]
    },
    {
      "id": "crud-page/08-program-open",
      "group": "es-crud-page",
      "title": "程序化控制弹窗",
      "tokens": [
        "useDialogApi"
      ]
    },
    {
      "id": "crud-page/09-hidden-column",
      "group": "es-crud-page",
      "title": "隐藏操作列",
      "tokens": [
        "operationColumn",
        "toolbarBtns"
      ]
    },
    {
      "id": "crud-page/10-full-business",
      "group": "es-crud-page",
      "title": "完整业务：多弹窗 + 导出",
      "tokens": [
        "dialogs",
        "renderFn",
        "renderBtnFn",
        "configTableOut"
      ]
    },
    {
      "id": "dialog/01-basic",
      "group": "use-dialog",
      "title": "弹窗基础与变体",
      "tokens": [
        "useDialogApi"
      ]
    },
    {
      "id": "dialog/02-form",
      "group": "use-dialog",
      "title": "表单弹窗",
      "tokens": [
        "useDialogApi"
      ]
    },
    {
      "id": "dialog/03-confirm",
      "group": "use-dialog",
      "title": "确认与消息弹窗",
      "tokens": [
        "useDialogApi"
      ]
    },
    {
      "id": "dialog/04-nested-modal",
      "group": "use-dialog",
      "title": "嵌套弹窗",
      "tokens": [
        "useDialogApi"
      ]
    },
    {
      "id": "dialog/05-advanced",
      "group": "use-dialog",
      "title": "高级弹窗",
      "tokens": [
        "useDialogApi"
      ]
    },
    {
      "id": "dialog/06-async",
      "group": "use-dialog",
      "title": "异步组件弹窗",
      "tokens": [
        "useDialogApi"
      ]
    },
    {